ae_id,speaker,start_time,end_time,sentence,source,targets
ES2008c.B.argumentstructs.Erik.45,B,2028.92,2031.744,"So like one through five, or",ES2008c.C.argumentstructs.Erik.32,NONE
ES2008c.D.argumentstructs.Erik.12,D,2031.01,2033.85,Like a radio type sorta situation ?,ES2008c.C.argumentstructs.Erik.32,NONE
ES2008c.A.argumentstructs.Erik.28,A,2036.2,2042.0,"Pre-set channels and then we're gonna need um numbers one through zero, right ?",ES2008c.C.argumentstructs.Erik.32,"{ES2008c.C.argumentstructs.Erik.33,ES2008c.A.argumentstructs.Erik.29}"
ES2008c.C.argumentstructs.Erik.33,C,2041.59,2043.69,Uh we wouldn't even need the numbers.,ES2008c.A.argumentstructs.Erik.28,"{ES2008c.B.argumentstructs.Erik.46,ES2008c.C.argumentstructs.Erik.34}"
ES2008c.B.argumentstructs.Erik.46,B,2042.7,2043.16,No.,ES2008c.C.argumentstructs.Erik.33,NONE
ES2008c.C.argumentstructs.Erik.34,C,2045.17,2047.81,I think maybe numbers seems  is kind of old-fashioned.,ES2008c.C.argumentstructs.Erik.33,NONE
ES2008c.A.argumentstructs.Erik.29,A,2047.12,2052.86,"Well, but in order to pre-set a cha oh I guess you can just hold it down when you get to one when you're scrolling through.",ES2008c.A.argumentstructs.Erik.28,{ES2008c.C.argumentstructs.Erik.35}
ES2008c.C.argumentstructs.Erik.35,C,2050.49,2059.97,"Yeah, yeah, you can just  and you need some kind of, I dunno, sort of up down kind of button, but the volume control could double for that, for example.",ES2008c.A.argumentstructs.Erik.29,{ES2008c.B.argumentstructs.Erik.47}
ES2008c.B.argumentstructs.60,B,2051.82,2052.06,Mm.,NONE,NONE
ES2008c.B.argumentstructs.Erik.47,B,2056.41,2057.33,"Yeah, up down.",ES2008c.C.argumentstructs.Erik.35,NONE
