ae_id,speaker,start_time,end_time,sentence,source,targets
ES2010d.A.argumentstructs.Erik.1,A,370.29,372.25,Is it technologically innovative ?,NONE,"{ES2010d.D.argumentstructs.Erik.1,ES2010d.D.argumentstructs.Erik.3,ES2010d.A.argumentstructs.Erik.4,ES2010d.D.argumentstructs.Erik.4,ES2010d.D.argumentstructs.Erik.5}"
ES2010d.A.argumentstructs.14,A,372.25,378.54,Oh sorry I'm taking over your job here. Go right ahead.,NONE,NONE
ES2010d.D.argumentstructs.12,D,374.79,376.43,I mean you're Project Manager.,NONE,NONE
ES2010d.D.argumentstructs.Erik.1,D,376.43,381.59,"Um yeah, I mean and it  does it have voice  I mean the phrase recognition on it ?",ES2010d.A.argumentstructs.Erik.1,{ES2010d.A.argumentstructs.Erik.2}
ES2010d.A.argumentstructs.Erik.2,A,384.1,388.52,Yes. Right ? We were able to do it with that kind of chip.,ES2010d.D.argumentstructs.Erik.1,"{ES2010d.C.argumentstructs.Erik.1,ES2010d.B.argumentstructs.Erik.1}"
ES2010d.C.argumentstructs.Erik.1,C,387.11,388.266,"Oh right, the",ES2010d.A.argumentstructs.Erik.2,NONE
ES2010d.B.argumentstructs.Erik.1,B,388.22,396.86,"We could do it with the chip, yes. It wasn't  we have no reflection of it on the prototype, but that's because it's only two dimensions, really.",ES2010d.A.argumentstructs.Erik.2,"{ES2010d.D.argumentstructs.Erik.2,ES2010d.A.argumentstructs.Erik.3}"
ES2010d.D.argumentstructs.Erik.2,D,391.84,394.38,And there's no way you can represent it on here.,ES2010d.B.argumentstructs.Erik.1,NONE
ES2010d.A.argumentstructs.Erik.3,A,393.54,398.87,"Yeah, right. That was  'kay. And we discussed that being included.",ES2010d.B.argumentstructs.Erik.1,NONE
ES2010d.D.argumentstructs.13,D,394.38,394.7,Y,NONE,NONE
ES2010d.D.argumentstructs.Erik.3,D,397.54,405.45,"Yeah, so. Then yes, then I would  well it isn't  what else would it need for it to be technologically innovative ?",ES2010d.A.argumentstructs.Erik.1,{ES2010d.C.argumentstructs.Erik.2}
ES2010d.C.argumentstructs.Erik.2,C,397.92,398.47,Right.,ES2010d.D.argumentstructs.Erik.3,NONE
ES2010d.B.argumentstructs.10,B,403.65,404.55,It,NONE,NONE
ES2010d.A.argumentstructs.Erik.4,A,405.54,409.13,"Well we don' have the  you know, we can't say channel, and it changes the channel, channel eight.",ES2010d.A.argumentstructs.Erik.1,NONE
ES2010d.D.argumentstructs.Erik.4,D,408.48,412.62,"And it doesn't cover anything other then T_V_, so I'd probably give it a three.",ES2010d.A.argumentstructs.Erik.1,"{ES2010d.A.argumentstructs.Erik.5,ES2010d.B.argumentstructs.Erik.2,ES2010d.A.argumentstructs.Erik.6}"
ES2010d.A.argumentstructs.Erik.5,A,411.0,411.34,Right.,ES2010d.D.argumentstructs.Erik.4,NONE
ES2010d.B.argumentstructs.Erik.2,B,413.0,413.65,Yeah.,ES2010d.D.argumentstructs.Erik.4,NONE
ES2010d.A.argumentstructs.Erik.6,A,414.18,414.51,Okay.,ES2010d.D.argumentstructs.Erik.4,NONE
ES2010d.D.argumentstructs.Erik.5,D,414.52,419.74,Even though it is  for just a T_V_ remote it's uh very advanced. But it is just a T_V_ remote.,ES2010d.A.argumentstructs.Erik.1,{ES2010d.A.argumentstructs.Erik.7}
ES2010d.A.argumentstructs.Erik.7,A,421.16,427.27,"Yeah. I'd go for a three or four on that one, so  okay, let's go for a three point five.",ES2010d.D.argumentstructs.Erik.5,"{ES2010d.C.argumentstructs.Erik.3,ES2010d.B.argumentstructs.Erik.3}"
ES2010d.C.argumentstructs.Erik.3,C,423.57,424.34,Yeah I go four.,ES2010d.A.argumentstructs.Erik.7,NONE
ES2010d.B.argumentstructs.Erik.3,B,428.03,428.7,Three and an half.,ES2010d.A.argumentstructs.Erik.7,NONE
ES2010d.A.argumentstructs.Erik.8,A,569.82,576.09,"Down here, interface type. We're gonna have the integrated scroll scroll wheel. Isn't  oh those are just regular buttons.",NONE,"{ES2010d.C.argumentstructs.Erik.4,ES2010d.B.argumentstructs.Erik.5,ES2010d.D.argumentstructs.Erik.7}"
ES2010d.C.argumentstructs.Erik.4,C,573.43,576.27,"No, we don't have the scroll. Buttons.",ES2010d.A.argumentstructs.Erik.8,{ES2010d.B.argumentstructs.Erik.4}
ES2010d.D.argumentstructs.14,D,575.45,575.98,But it's,NONE,NONE
ES2010d.B.argumentstructs.Erik.4,B,575.57,577.37,"Well, that's the push-button too, right there.",ES2010d.C.argumentstructs.Erik.4,"{ES2010d.D.argumentstructs.Erik.6,ES2010d.A.argumentstructs.Erik.9}"
ES2010d.D.argumentstructs.Erik.6,D,577.88,580.39,"Yeah, but i so i",ES2010d.B.argumentstructs.Erik.4,NONE
ES2010d.A.argumentstructs.Erik.9,A,578.61,579.0,This ?,ES2010d.B.argumentstructs.Erik.4,NONE
ES2010d.B.argumentstructs.Erik.5,B,579.64,583.87,Integrated scroll-wheel or push-button. We're really having just push-button interface.,ES2010d.A.argumentstructs.Erik.8,{ES2010d.A.argumentstructs.Erik.10}
ES2010d.A.argumentstructs.Erik.10,A,583.96,586.33,"Okay, so we can just go  um.",ES2010d.B.argumentstructs.Erik.5,NONE
ES2010d.D.argumentstructs.Erik.7,D,587.36,590.62,"But will we w actually we'll need two, won't we ?",ES2010d.A.argumentstructs.Erik.8,"{ES2010d.D.argumentstructs.Erik.8,ES2010d.B.argumentstructs.Erik.6,ES2010d.B.argumentstructs.Erik.7,ES2010d.D.argumentstructs.Erik.10}"
ES2010d.D.argumentstructs.Erik.8,D,590.62,593.51,One for the top and then one for the s one e for each side.,ES2010d.D.argumentstructs.Erik.7,NONE
ES2010d.B.argumentstructs.Erik.6,B,593.2,598.89,"But it  that just covers the type of button we're having. Because we're not doing a scroll on the side, it's still push-button.",ES2010d.D.argumentstructs.Erik.7,{ES2010d.C.argumentstructs.Erik.5}
ES2010d.C.argumentstructs.Erik.5,C,600.04,606.25,Oh like the  twenty nine means like you have both scrolls and push-buttons. But we don't have any scrolls.,ES2010d.B.argumentstructs.Erik.6,NONE
ES2010d.B.argumentstructs.Erik.7,B,603.5,605.71,Push-button. But we just have push,ES2010d.D.argumentstructs.Erik.7,{ES2010d.D.argumentstructs.Erik.9}
ES2010d.D.argumentstructs.Erik.9,D,604.44,604.97,Okay.,ES2010d.B.argumentstructs.Erik.7,NONE
ES2010d.A.argumentstructs.15,A,605.74,608.35,I think what Courtney's talking about is do we need to put two here ?,NONE,NONE
ES2010d.D.argumentstructs.Erik.10,D,607.69,619.6,Like because there's like one interface right here and then  because it's not gonna be on the same plane when you press the button. There's gonna have to be additional signals on the sides. So is that gonna be an extra one on each side ?,ES2010d.D.argumentstructs.Erik.7,"{ES2010d.A.argumentstructs.Erik.11,ES2010d.B.argumentstructs.Erik.8,ES2010d.A.argumentstructs.Erik.12,ES2010d.C.argumentstructs.Erik.6}"
ES2010d.A.argumentstructs.Erik.11,A,614.01,614.38,Right.,ES2010d.D.argumentstructs.Erik.10,NONE
ES2010d.B.argumentstructs.Erik.8,B,615.18,616.99,Yeah. Okay.,ES2010d.D.argumentstructs.Erik.10,NONE
ES2010d.A.argumentstructs.Erik.12,A,619.96,622.65,"I don't know, they might put us  well, let's just.",ES2010d.D.argumentstructs.Erik.10,NONE
ES2010d.C.argumentstructs.Erik.6,C,622.16,624.35,"Two interfaces, is that what w should we s say ?",ES2010d.D.argumentstructs.Erik.10,"{ES2010d.A.argumentstructs.Erik.13,ES2010d.D.argumentstructs.Erik.11}"
ES2010d.B.argumentstructs.11,B,623.92,625.55,Let's call it th,NONE,NONE
ES2010d.A.argumentstructs.Erik.13,A,623.93,625.29,Two or would it be three ?,ES2010d.C.argumentstructs.Erik.6,NONE
ES2010d.D.argumentstructs.Erik.11,D,624.47,630.69,"Or three, because of one on each side and one on top. I mean it's fine 'cause it comes out the same as twenty nine. Well less than twenty nine even.",ES2010d.C.argumentstructs.Erik.6,"{ES2010d.C.argumentstructs.Erik.7,ES2010d.B.argumentstructs.Erik.9}"
ES2010d.C.argumentstructs.Erik.7,C,625.94,626.81,"Okay, fine. Yeah.",ES2010d.D.argumentstructs.Erik.11,NONE
ES2010d.B.argumentstructs.Erik.9,B,630.77,631.55,Okay.,ES2010d.D.argumentstructs.Erik.11,NONE
