ae_id,speaker,start_time,end_time,sentence,source,targets
IS1008d.B.argumentstructs.Daan.1,B,266.28,280.112,We haven't um uh specified where the speaker or the microphone will be placed. That depends on the uh s design of the circuit board inside and uh what room is left um,NONE,"{IS1008d.A.argumentstructs.Daan.1,IS1008d.C.argumentstructs.Daan.1,IS1008d.A.argumentstructs.Daan.3}"
IS1008d.C.argumentstructs.18,C,279.99,280.24,Yeah.,NONE,NONE
IS1008d.A.argumentstructs.Daan.1,A,281.35,286.27,"I think the microphone is on on the top, uh on the middle, the  under the flip.",IS1008d.B.argumentstructs.Daan.1,{IS1008d.A.argumentstructs.Daan.2}
IS1008d.B.argumentstructs.20,B,283.97,287.01,"Yes, okay. Uh-huh.",NONE,NONE
IS1008d.A.argumentstructs.Daan.2,A,288.04,295.341,"So that will be the safe, so p any  the chip  it's not on the chip because you need to have microphone  to",IS1008d.A.argumentstructs.Daan.1,{IS1008d.B.argumentstructs.Daan.2}
IS1008d.B.argumentstructs.Daan.2,B,294.87,297.15,"No, I mean it depends on the design of the circuit board.",IS1008d.A.argumentstructs.Daan.2,NONE
IS1008d.C.argumentstructs.Daan.1,C,298.02,305.82,"But it shouldn't be under the flip either, because you can have the remote control closed, but you still might want to activate it by voice.",IS1008d.B.argumentstructs.Daan.1,NONE
IS1008d.A.argumentstructs.24,A,304.11,305.05,Uh it's it's,NONE,NONE
IS1008d.A.argumentstructs.Daan.3,A,305.91,324.85,"Yeah, but uh uh my opinion I think it's better under the flip because whenever you want to uh the talk, okay, so then you can speak then you can close it. But if you put it on the on the flip, okay, then uh technical I don't think it's uh feasible, 'cause most of the time you speak then it will be recognised.",IS1008d.B.argumentstructs.Daan.1,"{IS1008d.C.argumentstructs.Daan.2,IS1008d.C.argumentstructs.Daan.4}"
IS1008d.C.argumentstructs.Daan.2,C,324.72,338.66,"But if you've already got the remote control in your hand you need to open the flip to use the voice, why use the voice, why not just use your hand ? I mean the whole point of the voice is that if the remote control is sitting there and I'm too lazy to reach over and pick it up, I can just use my voice.",IS1008d.A.argumentstructs.Daan.3,{IS1008d.B.argumentstructs.Daan.3}
IS1008d.B.argumentstructs.Daan.3,B,338.28,343.93,Maybe I've got my hand in the popcorn bowl and I'm holding my cup of Coca-Cola in the other hand.,IS1008d.C.argumentstructs.Daan.2,{IS1008d.C.argumentstructs.Daan.3}
IS1008d.C.argumentstructs.Daan.3,C,344.6,348.776,Yeah. And you don't wanna let go of either one.,IS1008d.B.argumentstructs.Daan.3,{IS1008d.D.argumentstructs.Daan.1}
IS1008d.D.argumentstructs.Daan.1,D,345.49,350.14,I don't wanna say. Louder.  Yeah.,IS1008d.C.argumentstructs.Daan.3,NONE
IS1008d.C.argumentstructs.Daan.4,C,350.13,352.93,"I mean it doesn't have to be on the flip, it can be on the side somewhere.",IS1008d.A.argumentstructs.Daan.3,"{IS1008d.A.argumentstructs.Daan.4,IS1008d.D.argumentstructs.Daan.2}"
IS1008d.D.argumentstructs.Daan.2,D,352.21,353.25,Can also be on the side.,IS1008d.C.argumentstructs.Daan.4,NONE
IS1008d.A.argumentstructs.Daan.4,A,352.87,355.35,"Yeah, the sides maybe is good. So That's good idea.",IS1008d.C.argumentstructs.Daan.4,NONE
IS1008d.C.argumentstructs.19,C,353.49,353.9,Yeah.,NONE,NONE
IS1008d.B.argumentstructs.21,B,354.97,355.41,Mm-hmm.,NONE,NONE
IS1008d.D.argumentstructs.Daan.3,D,821.08,839.47,"So, obviously we w w I just did a run down the evaluation of the form, the fan uh the fancy stylishness of the  of the unit, the ease of use, speech recognition, cost, we've gone through these. Now, the company must evaluate the feasibility of being able to take enough of the market to justify in production.",NONE,{IS1008d.D.argumentstructs.Daan.4}
IS1008d.D.argumentstructs.Daan.4,D,840.59,856.22,"Or we project this over two years, but being that the market changes very very quickly, maybe there's no more interest in buying this thing in eighteen months from now. So, now we have to come up with a decision. Can the company sell two million units ? Can it sell it for fifty Euros ?",IS1008d.D.argumentstructs.Daan.3,"{IS1008d.A.argumentstructs.Daan.5,IS1008d.B.argumentstructs.Daan.4}"
IS1008d.A.argumentstructs.25,A,845.45,848.49,Yes. Yep.,NONE,NONE
IS1008d.A.argumentstructs.Daan.5,A,849.42,850.21,Of course.,IS1008d.D.argumentstructs.Daan.4,NONE
IS1008d.C.argumentstructs.20,C,849.59,849.84,Mm.,NONE,NONE
IS1008d.A.argumentstructs.26,A,853.4,891.27,Yep. Yep. Yes. Yes.,NONE,NONE
IS1008d.B.argumentstructs.Daan.4,B,855.18,893.22,"Could could I go to findings ? Uh uh um I would uh like to explore the possibility of using um alternative um delivery and sales channel which would be um to use the internet for promotion and ordering and then to drop-ship the p product to the customer's residence. That way you have no storage, you have no um  you do have transportation, still have the labour cost, but you don't have the transport to the uh point of sale. The point of sale is online.",IS1008d.D.argumentstructs.Daan.4,"{IS1008d.C.argumentstructs.Daan.5,IS1008d.B.argumentstructs.Daan.9}"
IS1008d.C.argumentstructs.Daan.5,C,872.408,874.55,"I was thinking the same thing, yeah.",IS1008d.B.argumentstructs.Daan.4,{IS1008d.C.argumentstructs.Daan.6}
IS1008d.C.argumentstructs.Daan.6,C,878.72,879.41,Directly.,IS1008d.C.argumentstructs.Daan.5,{IS1008d.A.argumentstructs.Daan.6}
IS1008d.C.argumentstructs.21,C,884.57,891.44,Um-hmm. Yeah.,NONE,NONE
IS1008d.A.argumentstructs.Daan.6,A,892.39,893.27,To the agents.,IS1008d.C.argumentstructs.Daan.6,{IS1008d.C.argumentstructs.Daan.7}
IS1008d.C.argumentstructs.Daan.7,C,894.08,901.12,"Yeah. You can do a shipping centre somewhere, or strategically place shipping centres to minimise distance costs.",IS1008d.A.argumentstructs.Daan.6,{IS1008d.B.argumentstructs.Daan.5}
IS1008d.B.argumentstructs.Daan.5,B,898.53,904.12,"Right, like Amazon. In fact, we should sell through Amazon, don't you think ? Or eBay, yeah.",IS1008d.C.argumentstructs.Daan.7,"{IS1008d.A.argumentstructs.Daan.7,IS1008d.B.argumentstructs.Daan.6,IS1008d.A.argumentstructs.Daan.9,IS1008d.C.argumentstructs.Daan.8}"
IS1008d.A.argumentstructs.27,A,900.73,901.09,Yes.,NONE,NONE
IS1008d.A.argumentstructs.Daan.7,A,902.19,903.099,"Or eBay, or",IS1008d.B.argumentstructs.Daan.5,NONE
IS1008d.A.argumentstructs.28,A,903.82,904.34,Yes.,NONE,NONE
IS1008d.C.argumentstructs.22,C,904.18,904.46,Yeah.,NONE,NONE
IS1008d.B.argumentstructs.Daan.6,B,906.38,909.984,There's an idea. Going with um,IS1008d.B.argumentstructs.Daan.5,NONE
IS1008d.A.argumentstructs.Daan.9,A,907.28,908.19,"Yeah, that's a good idea.",IS1008d.B.argumentstructs.Daan.5,"{IS1008d.A.argumentstructs.Daan.10,IS1008d.D.argumentstructs.Daan.5,IS1008d.B.argumentstructs.Daan.7}"
IS1008d.A.argumentstructs.Daan.10,A,909.54,911.168,To impro more profit and uh,IS1008d.A.argumentstructs.Daan.9,NONE
IS1008d.D.argumentstructs.Daan.5,D,910.53,914.7,S Upscale technology.  Well.,IS1008d.A.argumentstructs.Daan.9,NONE
IS1008d.A.argumentstructs.29,A,911.68,979.49,"Yeah, yes. Yeah.",NONE,NONE
IS1008d.B.argumentstructs.Daan.7,B,912.58,917.568,"Ah, we we're do you know, selling a unique product uh.",IS1008d.A.argumentstructs.Daan.9,NONE
IS1008d.C.argumentstructs.Daan.8,C,918.6,940.432,"That actually makes more sense if we're gonna make it so highly customisable, 'cause on the web people can look at the different options they have, see maybe what other people have done, what the range of possibility as, whereas if you're in a store, you can't  unless you're a highly imaginative person, you may not really know what it is you want, whereas on the web, if you have a bunch of pictures, it can sort of trigger ideas and",IS1008d.B.argumentstructs.Daan.5,"{IS1008d.D.argumentstructs.Daan.6,IS1008d.B.argumentstructs.Daan.8,IS1008d.D.argumentstructs.Daan.7}"
IS1008d.B.argumentstructs.22,B,927.6,938.59,Mm. Mm. Mm-hmm.,NONE,NONE
IS1008d.D.argumentstructs.Daan.6,D,928.5,930.25,There are several companies that have gone that way.,IS1008d.C.argumentstructs.Daan.8,NONE
IS1008d.B.argumentstructs.Daan.8,B,940.81,948.94,And you can even have an  a movie that you can rotate the object and look at the di the only thing that you're missing really is the weight.,IS1008d.C.argumentstructs.Daan.8,{IS1008d.D.argumentstructs.Daan.9}
IS1008d.C.argumentstructs.23,C,945.94,985.56,Yeah. The weight and feel. Yeah. Yeah. Yeah. Mm-hmm. Yes. Mm-hmm.,NONE,NONE
IS1008d.D.argumentstructs.15,D,948.66,951.04,"Weight, the feel of the product, but",NONE,NONE
IS1008d.B.argumentstructs.23,B,950.11,950.36,Mm.,NONE,NONE
IS1008d.B.argumentstructs.Daan.9,B,951.59,954.93,"We're getting used to that. It's not quite like trying on a shoe, but",IS1008d.B.argumentstructs.Daan.4,{IS1008d.B.argumentstructs.Daan.10}
IS1008d.B.argumentstructs.Daan.10,B,956.6,960.96,people are getting used to buying things online that they can't touch before buying.,IS1008d.B.argumentstructs.Daan.9,NONE
IS1008d.D.argumentstructs.Daan.7,D,960.34,968.428,"There are several that have gone through with the watches, too. You can customise a watch, you can see how it is at the f at the end of the production, you can change it uh",IS1008d.C.argumentstructs.Daan.8,{IS1008d.D.argumentstructs.Daan.8}
IS1008d.B.argumentstructs.24,B,966.15,967.43,Uh-huh.,NONE,NONE
IS1008d.D.argumentstructs.Daan.8,D,968.73,970.94,There's a lot of online that's  that is doing this now.,IS1008d.D.argumentstructs.Daan.7,NONE
IS1008d.D.argumentstructs.Daan.9,D,971.23,985.45,"And when you're rotating, you'll look behind and look this way uh  it's possible to do with this, maybe there's a possibility of selling more than two million units in one year, which could  you know, feasibili feasibility uh lower the price of the unit.",IS1008d.B.argumentstructs.Daan.8,"{IS1008d.A.argumentstructs.Daan.11,IS1008d.B.argumentstructs.Daan.11,IS1008d.A.argumentstructs.Daan.12}"
IS1008d.A.argumentstructs.Daan.11,A,987.8,988.24,We can.,IS1008d.D.argumentstructs.Daan.9,NONE
IS1008d.B.argumentstructs.Daan.11,B,988.58,988.89,Great.,IS1008d.D.argumentstructs.Daan.9,NONE
IS1008d.A.argumentstructs.Daan.12,A,989.94,1001.92,"I don't think that's uh not possible, it's uh  okay then, l uh let's wait for the production, okay, then uh you can evaluate the product, so how it looks like technically and uh how it look like uh the real.",IS1008d.D.argumentstructs.Daan.9,NONE
IS1008d.D.argumentstructs.Daan.10,D,1092.25,1093.87,I think we pretty much covered everything.,NONE,{IS1008d.B.argumentstructs.Daan.12}
IS1008d.A.argumentstructs.30,A,1094.08,1095.41,"Okay, so then uh",NONE,NONE
IS1008d.B.argumentstructs.Daan.12,B,1094.96,1095.89,Did you have something ?,IS1008d.D.argumentstructs.Daan.10,{IS1008d.C.argumentstructs.Daan.10}
IS1008d.C.argumentstructs.Daan.10,C,1095.568,1106.91,"Well I was just wondering about if we're gonna do a product evaluation then what about time for redesign if the users come back and tell us no this is bad, this is bad, we want this done differently.",IS1008d.B.argumentstructs.Daan.12,{IS1008d.A.argumentstructs.Daan.13}
IS1008d.A.argumentstructs.Daan.13,A,1109.0,1121.4,"Okay uh, let's take like this. Let's proceed with this model, okay, for the for the marketing direction, okay. So no more changes will be made, okay, in this  the basic design",IS1008d.C.argumentstructs.Daan.10,{IS1008d.A.argumentstructs.Daan.14}
IS1008d.A.argumentstructs.31,A,1121.4,1121.4,.,NONE,NONE
IS1008d.A.argumentstructs.Daan.14,A,1122.55,1131.57,"Okay ? So we will introduce m this model and uh let's introduce in the market and let's take the feedback from the customers, then we can uh go for the",IS1008d.A.argumentstructs.Daan.13,{IS1008d.A.argumentstructs.Daan.15}
IS1008d.A.argumentstructs.Daan.15,A,1132.77,1133.8,second generation.,IS1008d.A.argumentstructs.Daan.14,"{IS1008d.A.argumentstructs.Daan.16,IS1008d.C.argumentstructs.Daan.11}"
IS1008d.A.argumentstructs.Daan.16,A,1134.89,1139.47,"Okay. There's no end, there's not limit. Every every custom",IS1008d.A.argumentstructs.Daan.15,NONE
IS1008d.C.argumentstructs.Daan.11,C,1137.72,1144.62,The problem is there might not be a second generation if the first generation flops for some silly reason that we haven't thought of.,IS1008d.A.argumentstructs.Daan.15,"{IS1008d.D.argumentstructs.Daan.11,IS1008d.A.argumentstructs.Daan.17}"
IS1008d.D.argumentstructs.Daan.11,D,1140.52,1141.37,"Well, then it may not be.",IS1008d.C.argumentstructs.Daan.11,NONE
IS1008d.A.argumentstructs.32,A,1142.71,1142.85,Okay.,NONE,NONE
IS1008d.A.argumentstructs.Daan.17,A,1143.06,1150.65,"Well, every customer, okay, they have their own ideas, they have their own test, okay, so there's no end, there's no limit",IS1008d.C.argumentstructs.Daan.11,"{IS1008d.D.argumentstructs.Daan.12,IS1008d.C.argumentstructs.Daan.12}"
IS1008d.D.argumentstructs.Daan.12,D,1144.27,1147.437,Like people don't like wood.,IS1008d.A.argumentstructs.Daan.17,NONE
IS1008d.A.argumentstructs.33,A,1150.65,1150.65,.,NONE,NONE
IS1008d.C.argumentstructs.Daan.12,C,1152.82,1165.53,"No, but there's a difference between releasing a product that has been minimally tested and fine-tuned to suit a general range of requirements versus releasing a product that we think will work but we don't really have anything to back it up.",IS1008d.A.argumentstructs.Daan.17,{IS1008d.A.argumentstructs.Daan.18}
IS1008d.D.argumentstructs.16,D,1164.72,1221.22,very specific. Hmm.,NONE,NONE
IS1008d.A.argumentstructs.Daan.18,A,1165.88,1170.54,"Yeah, so that's the reason you are here for uh the design, okay, I hope you made a good design.",IS1008d.C.argumentstructs.Daan.12,{IS1008d.C.argumentstructs.Daan.13}
IS1008d.C.argumentstructs.Daan.13,C,1169.62,1181.56,"Yes, but I'm not everybody. I mean the whole point of user evaluation is to see what real people need. We have our own motivations in mind, we have our own ideas in mind, but that doesn't mean that that's what's gonna sell.",IS1008d.A.argumentstructs.Daan.18,"{IS1008d.A.argumentstructs.Daan.19,IS1008d.C.argumentstructs.Daan.14,IS1008d.C.argumentstructs.Daan.17}"
IS1008d.A.argumentstructs.Daan.19,A,1181.524,1197.97,"Yeah, but uh see, we ought to take a few considerations, okay, one is the price consideration, one is future consideration, okay, like uh you can eat uh  you can all eat more chi I can eat more chilli, okay, so i it's a depends on the individual taste, you know, so we have we have to balance somewhere.",IS1008d.C.argumentstructs.Daan.13,NONE
IS1008d.C.argumentstructs.Daan.14,C,1198.93,1213.552,"Yeah, of course. I'm just trying to point out that I think that your evaluation and redesign turnaround time is too short  well you have no redesign  not you personally, but in the project we have no redesign time and",IS1008d.C.argumentstructs.Daan.13,{IS1008d.B.argumentstructs.Daan.13}
IS1008d.A.argumentstructs.34,A,1209.68,1211.1,Yes. Yeah.,NONE,NONE
IS1008d.B.argumentstructs.25,B,1212.7,1213.05,um,NONE,NONE
IS1008d.B.argumentstructs.Daan.13,B,1214.34,1221.04,"Ed, d do you know what season of the year or time of the year is the most important for T_V_ remote control sales ?",IS1008d.C.argumentstructs.Daan.14,{IS1008d.B.argumentstructs.Daan.14}
IS1008d.B.argumentstructs.Daan.14,B,1222.58,1227.18,Would it be the Christmas season by any chance ? Sports season,IS1008d.B.argumentstructs.Daan.13,"{IS1008d.A.argumentstructs.Daan.20,IS1008d.D.argumentstructs.Daan.13,IS1008d.B.argumentstructs.Daan.15}"
IS1008d.A.argumentstructs.Daan.20,A,1224.69,1225.63,The sports time.,IS1008d.B.argumentstructs.Daan.14,NONE
IS1008d.B.argumentstructs.26,B,1227.18,1227.18,.,NONE,NONE
IS1008d.D.argumentstructs.Daan.13,D,1228.03,1238.38,"Right before the Eur  the World Cup.  World soccer. World Cup soccer, they need those things that they have their hands g occupied and they need to be able to talk to the con remote control.",IS1008d.B.argumentstructs.Daan.14,NONE
IS1008d.B.argumentstructs.Daan.15,B,1228.46,1229.61,Which sport season ?,IS1008d.B.argumentstructs.Daan.14,"{IS1008d.A.argumentstructs.Daan.21,IS1008d.B.argumentstructs.Daan.16}"
IS1008d.A.argumentstructs.Daan.21,A,1230.27,1230.88,Football.,IS1008d.B.argumentstructs.Daan.15,NONE
IS1008d.C.argumentstructs.24,C,1230.92,1231.66,Yeah.,NONE,NONE
IS1008d.B.argumentstructs.27,B,1231.73,1235.66,so maybe what,NONE,NONE
IS1008d.A.argumentstructs.35,A,1233.7,1303.58,Football. Yes. Yes. Yes. Research. Yep. Yes.,NONE,NONE
IS1008d.B.argumentstructs.Daan.16,B,1238.62,1257.77,"So I think what we need to do is perhaps to synchronise the final  the the launch of a user-tested device with some  special event. And and then um  so that gives us a little more time perhaps then we anticipated, because I don't know when the World Cup is, but I'm sure there's gonna be one.",IS1008d.B.argumentstructs.Daan.15,"{IS1008d.C.argumentstructs.Daan.15,IS1008d.D.argumentstructs.Daan.14}"
IS1008d.C.argumentstructs.Daan.15,C,1247.43,1248.53,"Yeah, that's a good idea.",IS1008d.B.argumentstructs.Daan.16,NONE
IS1008d.D.argumentstructs.Daan.14,D,1257.057,1258.99,Or any major sports.,IS1008d.B.argumentstructs.Daan.16,{IS1008d.B.argumentstructs.Daan.17}
IS1008d.B.argumentstructs.Daan.17,B,1259.29,1284.96,"Or another  m major sports event. Probably not the um the football games coming up the end of January. I think that might be a little too aggressive um, but, so, I'm just ig uh pointing out a uh a strategy to uh do some additional user testing pri and then to launch um at a a major sports event or uh perhaps to uh also",IS1008d.D.argumentstructs.Daan.14,"{IS1008d.C.argumentstructs.Daan.16,IS1008d.B.argumentstructs.Daan.18,IS1008d.A.argumentstructs.Daan.23}"
IS1008d.C.argumentstructs.25,C,1267.3,1277.5,Yeah. Mm-hmm.,NONE,NONE
IS1008d.C.argumentstructs.Daan.16,C,1283.758,1286.17,That's actually good place to advertise it too.,IS1008d.B.argumentstructs.Daan.17,NONE
IS1008d.B.argumentstructs.Daan.18,B,1286.56,1308.22,"And to work with motion pictures.  There might be some motion pictures that are coming out um  that are coming out on D_V_D_ that uh they need to have a m special remote control to work with it, so we could maybe work out a campaign with uh with Sony Pictures for example. Maybe some management has got uh relationships there we can leverage.",IS1008d.B.argumentstructs.Daan.17,NONE
IS1008d.C.argumentstructs.26,C,1287.43,1304.45,Yeah. Mm-hmm.,NONE,NONE
IS1008d.A.argumentstructs.Daan.23,A,1308.23,1312.38,"Yes, the  that of course uh I will convince the management to do that, okay.",IS1008d.B.argumentstructs.Daan.17,{IS1008d.B.argumentstructs.Daan.19}
IS1008d.B.argumentstructs.Daan.19,B,1312.24,1315.68,That's great.,IS1008d.A.argumentstructs.Daan.23,NONE
IS1008d.C.argumentstructs.Daan.17,C,1316.81,1330.33,"It's just something to to keep in mind, 'cause it's really really important. A lot of products have gone out there without being properly user-tested and completely flopped, when in fact it gets re-released a few years down the line with proper testing and it takes off like crazy.",IS1008d.C.argumentstructs.Daan.13,NONE
