ae_id,speaker,start_time,end_time,sentence,source,targets
IS1007d.A.argumentstructs.Daan.8,A,1546.896,1550.05,音声認識の統合についてはどうですか?,NONE,"IS1007d.B.argumentstructs.Daan.20, IS1007d.D.argumentstructs.Daan.29"
IS1007d.B.argumentstructs.Daan.20,B,1549.16,1551.23,音声認識機能はアドオン モジュールです。,IS1007d.A.argumentstructs.Daan.8,"IS1007d.B.argumentstructs.Daan.21, IS1007d.A.argumentstructs.Daan.10"
IS1007d.C.argumentstructs.30,C,1552.18,1552.46,うん。,NONE,NONE
IS1007d.B.argumentstructs.Daan.21,B,1552.46,1552.66,右 ？,IS1007d.B.argumentstructs.Daan.20,NONE
IS1007d.D.argumentstructs.Daan.29,D,1552.48,1557.41,それはオプションになります。誰かがそれを買いたいならそれを手に入れることができますが、そうでなければそれはできません。,IS1007d.A.argumentstructs.Daan.8,"IS1007d.A.argumentstructs.Daan.9, IS1007d.D.argumentstructs.Daan.30, IS1007d.C.argumentstructs.Daan.21"
IS1007d.A.argumentstructs.Daan.9,A,1557.04,1559.56,ああ、それはオプションでOKということですね。,IS1007d.D.argumentstructs.Daan.29,NONE
IS1007d.D.argumentstructs.Daan.30,D,1558.18,1558.96,それはオプションです。,IS1007d.D.argumentstructs.Daan.29,NONE
IS1007d.C.argumentstructs.Daan.21,C,1559.22,1570.432,それはオプションです。この調査によると、人々はスポンジ状のリモコンを好む傾向があり、,IS1007d.D.argumentstructs.Daan.29,NONE
IS1007d.A.argumentstructs.22,A,1566.64,1567.13,私は思う,NONE,NONE
IS1007d.D.argumentstructs.43,D,1568.81,1569.02,うん。,NONE,NONE
IS1007d.A.argumentstructs.Daan.10,A,1569.86,1578.429,これらすべてのモジュールを同じリモコンにまとめた方が良いと思います。親がこれらを紛失してしまう可能性があるからです。,IS1007d.B.argumentstructs.Daan.20,"IS1007d.D.argumentstructs.Daan.31, IS1007d.A.argumentstructs.Daan.11, IS1007d.B.argumentstructs.Daan.22, IS1007d.B.argumentstructs.Daan.24"
IS1007d.D.argumentstructs.Daan.31,D,1576.74,1588.04,そうですが、アドオンがあれば、子供たちはペアレンタルモジュールを非表示にして、親が使用できないようにすることができます。,IS1007d.A.argumentstructs.Daan.10,NONE
IS1007d.A.argumentstructs.Daan.11,A,1583.87,1593.152,うん。そうか、そうか。あるいは、親がどこに置いたか忘れてしまうかもしれないから、全部同じ場所に保管したほうがいいかもしれない。,IS1007d.A.argumentstructs.Daan.10,IS1007d.D.argumentstructs.Daan.32
IS1007d.D.argumentstructs.Daan.32,D,1593.08,1597.45,同じセットで、はい、そしてそれらを機能させるための個別のボタンです。,IS1007d.A.argumentstructs.Daan.11,NONE
IS1007d.B.argumentstructs.37,B,1594.32,1594.61,おお。,NONE,NONE
IS1007d.B.argumentstructs.Daan.22,B,1597.264,1621.65,問題は、もし顧客が特定のコンポーネントを欲しがっていて、子供がいないカップルなのでペアレンタルコントロールを欲しがらないとしたら、その製品を市場で販売すると、あらゆる種類の人々に出会う可能性があり、すべての人が私たちが提案するすべての機能を必要とするわけではないということです。そのため、このために顧客を失う可能性があります。わかりませんが、どう思いますか？,IS1007d.A.argumentstructs.Daan.10,"IS1007d.A.argumentstructs.Daan.12, IS1007d.D.argumentstructs.Daan.33"
IS1007d.A.argumentstructs.23,A,1597.75,1597.95,うん。,NONE,NONE
IS1007d.A.argumentstructs.Daan.12,A,1620.74,1625.1,つまり、これらのモジュールは機能するとしてもオプションになるということですね。,IS1007d.B.argumentstructs.Daan.22,IS1007d.B.argumentstructs.Daan.23
IS1007d.B.argumentstructs.Daan.23,B,1625.57,1629.58,はい、例えば、あなたがどう思うかは分かりません。あなたはマーケティングマネージャーです。,IS1007d.A.argumentstructs.Daan.12,NONE
IS1007d.D.argumentstructs.Daan.33,D,1628.31,1642.188,つまり、結婚しているカップルの数や、テレビを持っているカップルの数、あるいはテレビを持っている独身者の数を調べるマーケティング調査をどうするかということです。それに基づいて、私は,IS1007d.B.argumentstructs.Daan.22,NONE
IS1007d.A.argumentstructs.24,A,1628.63,1629.05,えー,NONE,NONE
IS1007d.B.argumentstructs.38,B,1631.62,1633.4,うん。,NONE,NONE
IS1007d.C.argumentstructs.31,C,1640.32,1640.53,うん。,NONE,NONE
IS1007d.B.argumentstructs.Daan.24,B,1642.56,1659.173,はい。しかし、問題は、これらのモジュール化によって生産コストが増加するのか、それとも減少するのかということです。,IS1007d.A.argumentstructs.Daan.10,"IS1007d.C.argumentstructs.Daan.22, IS1007d.A.argumentstructs.Daan.13, IS1007d.D.argumentstructs.Daan.34"
IS1007d.C.argumentstructs.Daan.22,C,1652.31,1654.662,まあ、それは同じくらいです。,IS1007d.B.argumentstructs.Daan.24,NONE
IS1007d.A.argumentstructs.Daan.13,A,1652.37,1654.307,増えると思います。,IS1007d.B.argumentstructs.Daan.24,"IS1007d.A.argumentstructs.Daan.14, IS1007d.C.argumentstructs.Daan.23"
IS1007d.C.argumentstructs.32,C,1656.17,1659.0,もしあなたが何かを持っていたら,NONE,NONE
IS1007d.A.argumentstructs.Daan.14,A,1657.96,1659.26,増えると思います。,IS1007d.A.argumentstructs.Daan.13,NONE
IS1007d.C.argumentstructs.Daan.23,C,1659.96,1670.341,ああ、もし何かを追加すると、ええ、それは3つの異なるピースを構築することになるからかもしれませんが、,IS1007d.A.argumentstructs.Daan.13,NONE
IS1007d.A.argumentstructs.25,A,1668.31,1668.67,ふーむ。,NONE,NONE
IS1007d.D.argumentstructs.Daan.34,D,1670.83,1673.98,ただし、3 つの異なるオプションを使用して単一の P_C_ で作成できます。,IS1007d.B.argumentstructs.Daan.24,"IS1007d.C.argumentstructs.Daan.24, IS1007d.D.argumentstructs.Daan.35, IS1007d.B.argumentstructs.Daan.25"
IS1007d.C.argumentstructs.Daan.24,C,1674.75,1687.814,ええ、ええ、すべての機能を同じモジュールに組み込んでいれば、安くなると思いますが、,IS1007d.D.argumentstructs.Daan.34,NONE
IS1007d.B.argumentstructs.39,B,1685.62,1688.02,うーん。そうだね。,NONE,NONE
IS1007d.D.argumentstructs.Daan.35,D,1687.75,1689.52,同じP_C_B_でそうそう。,IS1007d.D.argumentstructs.Daan.34,NONE
IS1007d.B.argumentstructs.Daan.25,B,1689.14,1701.34,そうですね、もう 1 つの側面は、既存の製品がある場合、同じ顧客を維持することになるということです。同じ顧客が他のアドオンを購入するために戻ってくるからです。,IS1007d.D.argumentstructs.Daan.34,"IS1007d.D.argumentstructs.Daan.36, IS1007d.B.argumentstructs.Daan.26"
IS1007d.D.argumentstructs.Daan.36,D,1702.0,1705.91,はい、その通りです。オプションで提供することもできます。,IS1007d.B.argumentstructs.Daan.25,NONE
IS1007d.B.argumentstructs.40,B,1702.96,1704.07,まあまあ,NONE,NONE
IS1007d.B.argumentstructs.Daan.26,B,1705.83,1727.86,そうです。今買わなくても、将来買うことができます。そのようにして、顧客を同じ顧客として維持し、何度も戻ってくるように誘っているのです。私たちはマイクロソフトに追随しようとしているわけではなく、マイクロソフトの真似をしたいわけでもありません。,IS1007d.B.argumentstructs.Daan.25,IS1007d.D.argumentstructs.Daan.37
IS1007d.D.argumentstructs.Daan.37,D,1718.77,1729.85,つまり、これは Microsoft 製品のアップデートのようなものです。アップデートして販売します。アップデートを行って販売します。,IS1007d.B.argumentstructs.Daan.26,"IS1007d.A.argumentstructs.Daan.15, IS1007d.B.argumentstructs.Daan.27"
IS1007d.A.argumentstructs.Daan.15,A,1720.222,1725.31,そして私たちは、私たちは、私たちは、私たちは、私たちはそれを望んでいません。,IS1007d.D.argumentstructs.Daan.37,NONE
IS1007d.B.argumentstructs.Daan.27,B,1730.21,1742.663,そうですね、購入者が上位にいけばアップグレードできるので、それは良いことですよね？ そうですね、それは v の生産量に依存します。,IS1007d.D.argumentstructs.Daan.37,NONE
IS1007d.C.argumentstructs.33,C,1735.04,1735.9,うん。,NONE,NONE
