ae_id,speaker,start_time,end_time,sentence,source,targets
IS1009d.A.argumentstructs.Daan.6,A,790.05,797.184,さて、マーケティングのための当社の特別な機能は何でしょうか？それは本当に珍しい音声認識です,NONE,"IS1009d.D.argumentstructs.Daan.3, IS1009d.A.argumentstructs.Daan.7"
IS1009d.D.argumentstructs.Daan.3,D,796.32,802.57,音声認識は当社の大きなセールスポイントだと思います。この価格帯では他社には音声認識機能が搭載されていないようです。,IS1009d.A.argumentstructs.Daan.6,NONE
IS1009d.C.argumentstructs.14,C,799.16,835.99,うん。うん。うん。うん。うん。,NONE,NONE
IS1009d.A.argumentstructs.Daan.7,A,802.76,809.37,そして、もう 1 つは、基本的には形状や実用性です。,IS1009d.A.argumentstructs.Daan.6,"IS1009d.D.argumentstructs.Daan.4, IS1009d.A.argumentstructs.Daan.8"
IS1009d.D.argumentstructs.Daan.4,D,809.81,823.31,ええ、そうですね、みんなリモコンは実用的だと言うと思います。見た目にこだわらないといけないと思います。,IS1009d.A.argumentstructs.Daan.7,NONE
IS1009d.A.argumentstructs.Daan.8,A,811.09,817.85,ご存知の通り、色彩です。,IS1009d.A.argumentstructs.Daan.7,IS1009d.D.argumentstructs.Daan.5
IS1009d.A.argumentstructs.23,A,820.76,827.1,うん。かわいいね。うん。,NONE,NONE
IS1009d.D.argumentstructs.Daan.5,D,824.45,837.62,一番かわいいリモコンです。画像で遊ばなければなりません。カタツムリの画像で遊ばなければなりません。視覚で遊ばなければなりません。そして音声認識です。これらが推進すべき2つのことだと思います。見た目,IS1009d.A.argumentstructs.Daan.8,IS1009d.D.argumentstructs.Daan.6
IS1009d.D.argumentstructs.Daan.6,D,838.97,841.85,そして音声認識。これらが私たちの2つのセールスポイントになります。,IS1009d.D.argumentstructs.Daan.5,NONE
