ae_id,speaker,start_time,end_time,sentence,source,targets
TS3003b.A.argumentstructs.Daan.9,A,1584.91,1587.97,いいえ、スクロールボタンを実装できるでしょうか?,NONE,"TS3003b.A.argumentstructs.Daan.10, TS3003b.A.argumentstructs.Daan.11"
TS3003b.A.argumentstructs.Daan.10,A,1589.84,1591.54,それともジョイスティックのようなものですか?,TS3003b.A.argumentstructs.Daan.9,NONE
TS3003b.B.argumentstructs.7,B,1590.32,1636.18,うーん。うん。うん。うーん。うん。うーん。,NONE,NONE
TS3003b.A.argumentstructs.Daan.11,A,1593.04,1601.682,他にも方法はあります。電話機を見てください。ソニーの電話機にはスクロールボタンがあり、名前や,TS3003b.A.argumentstructs.Daan.9,"TS3003b.D.argumentstructs.Daan.15, TS3003b.C.argumentstructs.Daan.8"
TS3003b.D.argumentstructs.Daan.15,D,1603.26,1626.12,それは本当ですが、うーん、そんなに速くチャンネルを切り替えられるテレビは多くないと思います。ですから、テレビには実際にすべてのチャンネルを表示してスクロールできる機能が必要です。そして、多くのチャンネルにそれが備わっているかどうかはわかりません。多くのテレビにそれが備わっているなら。,TS3003b.A.argumentstructs.Daan.11,TS3003b.A.argumentstructs.Daan.12
TS3003b.C.argumentstructs.Daan.8,C,1626.06,1638.6,そうですね。それに加えて、高齢者に焦点を合わせるなら、彼らは適応しなければなりません。彼らはスクロールボタンを使うことに慣れていません。だから、基本的なレイアウトにこだわるべきかもしれません。,TS3003b.A.argumentstructs.Daan.11,NONE
TS3003b.A.argumentstructs.Daan.12,A,1635.36,1635.9,それは正しい。,TS3003b.D.argumentstructs.Daan.15,NONE
TS3003b.D.argumentstructs.27,D,1635.81,1636.11,うんうん。,NONE,NONE
